{
  "checkpoint_version": 1,
  "workspace_id": "synthetic-workspace",
  "created_at": "2026-07-14T12:00:00Z",
  "issues": {
    "demo-1": {
      "updated_at": "2026-07-13T09:30:00Z",
      "fingerprint": "0123456789abcdef0123456789abcdef0123456789abcdef0123456789abcdef"
    },
    "demo-2": {
      "updated_at": null,
      "fingerprint": "abcdef0123456789abcdef0123456789abcdef0123456789abcdef0123456789"
    }
  }
}
